"conversation_id_str","created_at","favorite_count","full_text","id_str","image_url","in_reply_to_screen_name","lang","location","quote_count","reply_count","retweet_count","tweet_url","user_id_str","username"
"1902562348302504380","2025-03-20T03:26:26.000Z","3","""Kalau ini BUMN yang non-Perum yang kita inbrengkan, berhubungan dengan operasional. Yang di luar Perum pokoknya,"" kata Tiko. https://t.co/Wd4MzJg4Gg","1902562348302504380","","","in","","0","0","0","https://x.com/detikcom/status/1902562348302504380","69183155","detikcom"
"1904189766247276859","2025-03-24T15:13:13.000Z","0","Herman Khaeron: Komisi VI DPR RI Dukung Penuh Kepengurusan Danantara https://t.co/rmPxMtUbOx","1904189766247276859","","","in","","0","0","0","https://x.com/e100ss/status/1904189766247276859","848614550","e100ss"
"1904064742005866881","2025-03-24T06:56:24.000Z","0","""Di kami tidak boleh ada yang rangkap jabatan di level di bawah kami,"" kata Rosan. https://t.co/6YQMA9HOON","1904064742005866881","","","in","","1","0","0","https://x.com/detikcom/status/1904064742005866881","69183155","detikcom"
"1903071409846489477","2025-03-21T13:09:16.000Z","0","""Saya tegaskan bahwa setiap saat, pekerjaan dan semua kebijakan Danantara ini harus bisa diaudit, harus bisa diawasi, harus bisa dipertanggungjawabkan setiap saat oleh siapapun yang menginginkan,"" ujar Prabowo. | #Danantara #Prabowo 

https://t.co/FOra5I8vox","1903071409846489477","","","in","","1","1","1","https://x.com/kompascom/status/1903071409846489477","23343960","kompascom"
"1902609129967112536","2025-03-20T06:32:20.000Z","0","Inbreng BUMN ke Danantara Segera Dilakukan untuk Perseroan, Bagaimana Nasib Perum?

~SA #BUMN #DANANTARA
https://t.co/vTPhdNGJvP","1902609129967112536","","","in","","0","1","1","https://x.com/kompascom/status/1902609129967112536","23343960","kompascom"
"1904305959478198401","2025-03-24T22:54:55.000Z","1","Tim DANANTARA kmrin diumumkan. Waktu yg sama IHSG anjlok dibawah 6rb dan tutup di 6.161, turun 1,55% atau 96.96. Rosan bilang tim ini dijamin profesional. Mslahnya dinegeri ini brpa banyak janji yg bisa ditepati? trutama tnpa bsa terjamah hukum dg dalih Business Judgement Rule? https://t.co/Gv0JRIZHu1","1904305959478198401","https://pbs.twimg.com/media/Gm10LYKbYAA9SSl.jpg","","in","","0","0","0","https://x.com/manesinamso/status/1904305959478198401","37439870","manesinamso"
"1904206166143717717","2025-03-24T16:18:23.000Z","0","Mantan PM Thailand jadi salah satu Dewan Penasehat Danantara hahahahaha mamam noh antek aseng.","1904206166143717717","","","in","","0","0","1","https://x.com/arkalyorda/status/1904206166143717717","375442644","arkalyorda"
