"conversation_id_str","created_at","favorite_count","full_text","id_str","image_url","in_reply_to_screen_name","lang","location","quote_count","reply_count","retweet_count","tweet_url","user_id_str","username"
"1909390779925352929","2025-04-07T23:40:11.000Z","0","BPI Danantara dapat mendorong investasi di berbagai sektor, termasuk hilirisasi industri. https://t.co/cXXPptrij9","1909390779925352929","https://pbs.twimg.com/media/Gn-EyeGbwAEYCYc.jpg","","in","","0","0","0","https://x.com/gayoesme/status/1909390779925352929","1566807909799182336","gayoesme"
"1909390450945040676","2025-04-07T23:38:52.000Z","0","Danantara ikut trend dunia: Alokasikan kekayaan negara, biar infrastruktur makin kinclong. https://t.co/CvbdnbXPKx","1909390450945040676","https://pbs.twimg.com/media/Gn-EfLdbEAAHM4-.jpg","","in","","0","0","0","https://x.com/gayoesme/status/1909390450945040676","1566807909799182336","gayoesme"
"1909390399682363485","2025-04-07T23:38:40.000Z","0","Peduli setan sama interview semlm. Org pada sibuk bursa saham. F ur danantara ( semua isi org asing dan koruptor)","1909390399682363485","","","in","","0","0","0","https://x.com/linkMovieGeek/status/1909390399682363485","1455706706357350405","linkMovieGeek"
"1909256518803034480","2025-04-07T23:37:35.000Z","65","@poin_opini Suka banget bikin musuh imajiner, padahal danantara isinya asing wkwkwkwk https://t.co/KC5BtyZ60d","1909390124154314928","https://pbs.twimg.com/media/Gn-EMuFbwAYNmV_.jpg","poin_opini","in","","0","0","3","https://x.com/kisahmagis_/status/1909390124154314928","1463072882137784334","kisahmagis_"
"1909390120756900199","2025-04-07T23:37:34.000Z","0","Kehadiran BPI Danantara dapat mengurangi ketergantungan BUMN terhadap penyertaan modal negara. https://t.co/MEKnY83N6t","1909390120756900199","https://pbs.twimg.com/media/Gn-ELvJbsAAyqaK.jpg","","in","","0","0","0","https://x.com/gayoesme/status/1909390120756900199","1566807909799182336","gayoesme"
"1909389750991307239","2025-04-07T23:36:06.000Z","0","Danantara adalah salah satu
ide yang bagus jika dijadikan lembaga negara. https://t.co/LkjPoerKZz","1909389750991307239","https://pbs.twimg.com/media/Gn-D2kAbwAInmpk.jpg","","in","","0","0","0","https://x.com/gayoesme/status/1909389750991307239","1566807909799182336","gayoesme"
"1909358726471127204","2025-04-07T23:35:05.000Z","1","@DoankWarto Harap Danantara.... Bakal obral dollar....

Langsung 5.000...

Dollar.....","1909389495356866657","","DoankWarto","in","","0","0","0","https://x.com/mbah_pujonggo/status/1909389495356866657","1213281894260822016","mbah_pujonggo"
"1909389299197636954","2025-04-07T23:34:18.000Z","0","prabski kalo ngga nyebut mbg sama danantara strokenya kambuh kah","1909389299197636954","","","in","","0","0","0","https://x.com/keitsukidate/status/1909389299197636954","1379646502956494856","keitsukidate"
"1909384996911198667","2025-04-07T23:32:39.000Z","1","Keyword : MBG, Bangsa Asing, Danantara, Kita negara besar

Nanti pas IHSG open tirai, pake kata kunci apa ya blio","1909388885769302121","","KomorebiPerson","in","","0","1","0","https://x.com/KomorebiPerson/status/1909388885769302121","1499196200310173696","KomorebiPerson"
"1909388758275002625","2025-04-07T23:32:09.000Z","0","3x nyapres dikira benar² memahami masalah negeri ini 
Kenapa mahasiswa demo? 
Oh itu ditunggangi asing, ada yang bayar.... 

Osang aseng asing 
Itu di danantara banyak asingnya 😂","1909388758275002625","","","in","","0","0","0","https://x.com/mudzakirmanaf/status/1909388758275002625","538716428","mudzakirmanaf"
"1909093660777492716","2025-04-07T23:31:44.000Z","0","@KompasTV Dikit² solusinya Danantara 🥲","1909388655728509266","","KompasTV","in","","0","0","0","https://x.com/riyadul_huda2/status/1909388655728509266","735657930570223618","riyadul_huda2"
"1909237479254995283","2025-04-07T23:31:33.000Z","17","Prabowo memuji all presiden. I'm lucky katany krn pendahulu itu tp  trselip pesan besar Soeharto. Bahkan memuji ayahny begawan ekonomi Soemitro sbg pengagas danantara. Menurut sy ini pembenaran pdhl danantara tanpa sosialisasi dan tak pernah dikampanyekannya","1909388606084726800","","feriamsari","in","","0","1","3","https://x.com/feriamsari/status/1909388606084726800","99728171","feriamsari"
"1909388340295877124","2025-04-07T23:30:29.000Z","1","Padahal MBG lebih solutif buat  ngelawan Traif Trump dari pada Danantara. 🤓","1909388340295877124","","","in","","0","0","0","https://x.com/MuHelmyYahya/status/1909388340295877124","1404806954183188485","MuHelmyYahya"
"1909381705758302656","2025-04-07T23:15:58.000Z","0","@GuruGembull 8. Bapak bicara soal efisiensi APBN dan anti korupsi, tapi Danantara diisi oleh banyak figur kontroversial termasuk mantan PM Thailand Thaksin yang pernah dihukum karena korupsi. Bagaimana Anda bisa menjamin integritas lembaga yang diisi figur-figur problematis?","1909384686495056005","","dimarsasongko98","in","","0","1","0","https://x.com/dimarsasongko98/status/1909384686495056005","1781618112259076096","dimarsasongko98"
"1909173317077999673","2025-04-07T23:12:31.000Z","0","@republikaonline Mana rakyat percaya pak, dikabinet bapak banyak koruptor yg jadi menteri + import koruptor u/ danantara 😬","1909383816793538582","","republikaonline","in","","0","0","0","https://x.com/MatairPrint/status/1909383816793538582","2292220128","MatairPrint"
"1909379663451111871","2025-04-07T23:10:48.000Z","1","Danantara tuh bukan jawaban buat tarif AS. Bukan solusi darurat!!!!! @prabowo","1909383384075493754","","Kanalayas","in","","0","0","0","https://x.com/Kanalayas/status/1909383384075493754","1818237489968193539","Kanalayas"
"1909382820017193127","2025-04-07T23:08:33.000Z","1","Danantara noh dikendarai antek asing, mana korup semua lagi","1909382820017193127","","","in","","0","0","0","https://x.com/m0lam0/status/1909382820017193127","1548480418696945667","m0lam0"
"1909191510735851735","2025-04-07T23:07:51.000Z","0","@NarasiNewsroom @NajwaShihab Sebut saja beberapa kebijakan kontroversial, seperti LPG eceran, RUU yang kilat, danantara dll. Kemudian situasi Indonesia yg tidak stabil dengan adanya demo, rupiah yg anjlok, teror kpd jurnalis. Sebelum ini, mbak najwa dan narasi sangat sigap dan kritis membahas isu2 spt itu","1909382644212683117","","Giodr2","in","","0","0","0","https://x.com/Giodr2/status/1909382644212683117","1290156948172574720","Giodr2"
"1909382206109467064","2025-04-07T23:06:07.000Z","0","Cuy yang bawa orang asing tuh malah si bapak. Itu Danantara aja pengurusnya orang-orang asing semua, mana isinya orang problematik semua lagi. Kocak dah nih orang.","1909382206109467064","","","in","","0","0","0","https://x.com/happiestyas/status/1909382206109467064","916869537324134403","happiestyas"
"1909378283411796394","2025-04-07T23:06:01.000Z","0","@OFFICIAL_VVOOF huft apa dong 😔😔😔 pasti dia ngomong danantara sm efisiensi jg","1909382183959286038","","ijalmerajalela","in","","0","0","0","https://x.com/deerchivez/status/1909382183959286038","1319042689174630400","deerchivez"
"1909381551760330813","2025-04-07T23:04:08.000Z","0","yang gue tangkep cuman ""danantara ini kehendak ayahanda"" 😭😭😭😭😭😭😭😭","1909381708174311504","","heavenlydollete","in","","0","0","0","https://x.com/heavenlydollete/status/1909381708174311504","788495827","heavenlydollete"
"1909379663451111871","2025-04-07T23:03:34.000Z","0","Gila ya, udah kena tarif bego dari Trump, produk kita dibantai, ekspor makin sulit, usaha dalam negeri megap-megap tapi jawabannya malah “Tenang, kita punya Danantara kok!""

???? Danantara jimat sakti kh","1909381563760226544","","Kanalayas","in","","0","0","0","https://x.com/Kanalayas/status/1909381563760226544","1818237489968193539","Kanalayas"
"1908283993931604225","2025-04-07T23:03:04.000Z","0","@Galih_D_Ariarto @yusuf_dumdum @DedynurPalakka DANANTARA berpotensi besar tingkatkan ekonomi Indonesia dari 5% ke 8% dengan aset $900M, fokus pada sektor strategis seperti infrastruktur dan energi. Tapi, keberhasilannya tergantung pada manajemen efektif dan bebas dari intervensi politik. Transparansi dan tata kelola jadi","1909381440896106786","","Galih_D_Ariarto","in","","0","1","0","https://x.com/grok/status/1909381440896106786","1720665183188922368","grok"
"1909379663451111871","2025-04-07T23:01:51.000Z","0","Itu Danantara buat siapa? Buat rakyat kecil atau buat kolega elit yang lagi cari tempat baru buat nyimpen duit? Jangan sok nasionalis lah anjing.","1909381135085584527","","Kanalayas","in","","0","1","0","https://x.com/Kanalayas/status/1909381135085584527","1818237489968193539","Kanalayas"
"1909326096866460007","2025-04-07T23:00:49.000Z","2","@intinyadeh udah bilang aja kalo mau digarong abis tu danantara","1909380872232718425","","intinyadeh","in","","0","0","0","https://x.com/hellena_____/status/1909380872232718425","1896556974218838016","hellena_____"
"1908283993931604225","2025-04-07T23:00:35.000Z","0","@grok @yusuf_dumdum @DedynurPalakka Bagaimana dengan DANANTARA apakah cukup berperan untuk pertumbuhan ekonomi Indonesia?","1909380816482021433","","grok","in","","0","1","0","https://x.com/Galih_D_Ariarto/status/1909380816482021433","1690406617","Galih_D_Ariarto"
"1909378283411796394","2025-04-07T22:58:36.000Z","0","@OFFICIAL_VVOOF pls tambahin danantara","1909380313727574506","","ijalmerajalela","in","","0","1","0","https://x.com/deerchivez/status/1909380313727574506","1319042689174630400","deerchivez"
"1909380213559243038","2025-04-07T22:58:12.000Z","0","Melalui inovasi dan kolaborasi, Danantara berkomitmen untuk membuka akses yang lebih luas bagi masyarakat dalam berbagai sektor. https://t.co/GNfi3lP1In","1909380213559243038","https://pbs.twimg.com/media/Gn97Lk6a8AANz4H.jpg","","in","","0","0","0","https://x.com/WaneyToto/status/1909380213559243038","1697078751002316800","WaneyToto"
"1909379746464702867","2025-04-07T22:56:20.000Z","0","Danantara fokus pada pembangunan investasi yang merata ke seluruh wilayah Indonesia. https://t.co/smxacjensc","1909379746464702867","https://pbs.twimg.com/media/Gn96wQzbwAA-7ol.jpg","","in","","0","0","0","https://x.com/WaneyToto/status/1909379746464702867","1697078751002316800","WaneyToto"
"1909080577002836151","2025-04-07T22:52:07.000Z","0","@KompasTV emang apa aja yang udah dipenuhi sampe nilai 6? maksudnya pajak naik, gas, DANANTARA, RUU TNI, Rp naik dan masih banyak lagi","1909378686224404750","","KompasTV","in","","0","0","0","https://x.com/4ssahongsam/status/1909378686224404750","1308273449282879488","4ssahongsam"
"1909170255941054847","2025-04-07T22:51:31.000Z","0","@FelixSGL1 Srimul out trs yg ganti ponakan, masih gak puas dgn danantara ini 🗿","1909378533065216187","","FelixSGL1","in","","0","0","0","https://x.com/sandyuda15/status/1909378533065216187","181822588","sandyuda15"
"1909377042094907458","2025-04-07T22:45:36.000Z","0","Akhirnya saham asia pada amblek

Indon yak apa? 
Udah tutup dari kapan lalu
Tutup buka tutup buka tutup lagi
Wakakakakkkkk
🙃

Solusinya MBG dan Danantara gajetot 🙃","1909377042094907458","","","in","","0","0","0","https://x.com/svargaskara/status/1909377042094907458","1748926586529980416","svargaskara"
"1909326096866460007","2025-04-07T22:41:28.000Z","59","@marhaendy_ @intinyadeh Entah beliau pikun atau pura2 ga tahu ada antek asing di danantara yang beliau bangga2in 😒😒","1909376002025046306","","marhaendy_","in","","0","0","1","https://x.com/arsatita8/status/1909376002025046306","2335971830","arsatita8"
"1909376000661782781","2025-04-07T22:41:27.000Z","0","Prestasi pemerintah Pak @prabowo @gibran_tweet habiskan APBN demi kabinet gemoy agar pejabat hidup hedon, efisiensi anggaran Kementrian demi Danantara shg hotel2 PHK staf, sahkan RUU TNI mjd UU, IHSG crash, rakyat hidup menderita tdk bisa mudik Lebaran  https://t.co/urClIqI6yp","1909376000661782781","","","in","","0","0","0","https://x.com/devi_pray/status/1909376000661782781","1425292800","devi_pray"
"1909261821540004288","2025-04-07T22:40:51.000Z","0","@whoopziiy Pemerintah mau nunjukin hebat nya MBG danantara dan IKN? 🤣","1909375847842414615","","whoopziiy","in","","0","0","0","https://x.com/dengkul_cacing/status/1909375847842414615","1519512323865538560","dengkul_cacing"
"1909375634331291853","2025-04-07T22:40:00.000Z","0","KPK memastikan ketuanya, Setyo Budiyanto tidak mengatasnamakan diri sendiri dalam Tim Komite Pengawasan dan Akuntabilitas Badan Pengelola Investasi Daya Anagata Nusantara (BPI Danantara). https://t.co/KVAZ4PcD6F","1909375634331291853","","","in","","0","0","0","https://x.com/mediaindonesia/status/1909375634331291853","68930552","mediaindonesia"
"1909009946995483052","2025-04-07T22:36:19.000Z","0","@NenkMonica Danantara https://t.co/IIbvt4jvbg","1909374705876058341","https://pbs.twimg.com/tweet_video_thumb/Gn92K2ubUAAKT3f.jpg","NenkMonica","in","","0","0","0","https://x.com/Leonk21/status/1909374705876058341","104046272","Leonk21"
"1909270147174699238","2025-04-07T22:34:16.000Z","1","@evaluasy danantara apakabar diisi kekuatan asing wkwkwkwk","1909374194028363851","","evaluasy","in","","0","0","0","https://x.com/mukhlisticky/status/1909374194028363851","81472474","mukhlisticky"
"1908869953689960573","2025-04-07T22:34:07.000Z","2","@Boediantar4 Yuk fokus lagi yuk pd issue2 besar....adili mulyono...tuntut sahkan UU perampasan aset.. kawal danantara..mslh pagar laut di berbagai daerah yg berpotensi jd negara dlm negara dll...jgn mau dibelokkan dgn issue2 murahan sprt ini termasuk perselingkuhan RK dll","1909374155205886107","","Boediantar4","in","","0","1","0","https://x.com/Widyawa64704930/status/1909374155205886107","904613821574144005","Widyawa64704930"
"1909124537003975156","2025-04-07T22:33:40.000Z","0","@ObiWan_Catnobi apa-apa kalau gak MBG ya danantara solusinya 😆😆","1909374039459807651","","ObiWan_Catnobi","in","","0","0","0","https://x.com/saskiarahmaulia/status/1909374039459807651","1023427803386064898","saskiarahmaulia"
"1909373740062064960","2025-04-07T22:32:28.000Z","0","Ya kalo danantara bagus ya pak kek temasek
Belom2 ae dibikin undang2 gak bisa menjarain pengurus danantara kalo rugi

Mana idenya dari koruptor pulak
Dan pengurusnya kerabat lu

Siapa yg bisa positif thinking? 
🙃🙃","1909373740062064960","","","in","","0","0","0","https://x.com/svargaskara/status/1909373740062064960","1748926586529980416","svargaskara"
"1909124537003975156","2025-04-07T22:30:15.000Z","26","@ObiWan_Catnobi Pls ini orang kenapa ya, setiap ditanya solusi selalu ga nyambung. Kmrn katanya strategi tarif dagang salah satunya dgn MBG, wtf ga nyambung bgt bro. Lalu skrng danantara 🤔

Please voters/buzzernya ada yg paham korelasi danantara sebagai  solusi kebijakan tarif dagang US ga?","1909373182110568696","","ObiWan_Catnobi","in","","0","2","0","https://x.com/halsuisseeeoo/status/1909373182110568696","1431990238096683021","halsuisseeeoo"
"1909180599551852716","2025-04-07T22:24:15.000Z","2","@ARSIPAJA ""Kita memang harus berdikari"": berwibawa, percaya diri, superior. 
""Karena itu kita punya Danantara"": opini jelek, opini  jelek, opini jelek.","1909371672064671936","","ARSIPAJA","in","","0","0","0","https://x.com/kamsskyy/status/1909371672064671936","2529472464","kamsskyy"
"1909371631778271494","2025-04-07T22:24:06.000Z","0","Pengamat: Danantara Terlalu Banyak Cita-cita Daripada Fakta

https://t.co/EyRHc0ISSZ https://t.co/d1YaivxLS4","1909371631778271494","https://pbs.twimg.com/media/Gn9zYRzbwAEfy_t.jpg","","in","","0","0","0","https://x.com/JengKanq/status/1909371631778271494","1342905759130996737","JengKanq"
"1909365957082124693","2025-04-07T22:18:29.000Z","0","Fokus duluu masalah makroo terutama perusahaan ekspor .. selain bebas ppn ada gak contoh  tarif bea keluar dikurangin . Suku bunga bank gimana dll. Makro pak makro. Jgn mikirin danantara sama mbg teruss","1909370219254235353","","rendsss99","in","","0","0","0","https://x.com/rendsss99/status/1909370219254235353","440881618","rendsss99"
"1909369567467683987","2025-04-07T22:15:53.000Z","0","ni buzzer keliatan bgt tololnya
lu diblok beliau karena opini lo bodoh.
gw rasa pertanyaan Bu Uni Lubis sudah cukup terstruktur, beliau menanyakan terkait fenomena demonstrasi yang marak terkait kebijakan yang dibuat oleh P word. Lu kira MBG, Danantara juga gak didemo?","1909369567467683987","","","in","","0","0","0","https://x.com/lastseenseptmbr/status/1909369567467683987","1473857091353800704","lastseenseptmbr"
"1909369032211677241","2025-04-07T22:13:46.000Z","0","Apasih anjg danantara juga dikelola sama orang-orang dia juga, ga nyambung bangst, berdikari apanya? Dengan apa njg? Polri kelola lahan orang maksud lu?","1909369032211677241","","","in","","0","0","0","https://x.com/jungwonshayla/status/1909369032211677241","1790612527229095936","jungwonshayla"
"1909093660777492716","2025-04-07T22:11:22.000Z","0","@KompasTV Oo gitu, emang begitu danantara ada, rupiah lgsg meroket Ke 10rb gitu?
Klo trump mengumumkan tarif, rupiah lgsg anjlok dan begitu ada danantara bukannya anjlok jg.
Tarif+danantara jadi ancur, tuh skrg jd 17 rb. Tambah lg janda jadi komisaris, tambah males byr pajak.","1909368427665670467","","KompasTV","in","","0","0","0","https://x.com/Mrgp_crypto/status/1909368427665670467","980055473092222977","Mrgp_crypto"
"1909366238054388092","2025-04-07T22:02:43.000Z","0","Pembahasan danantara, ternyata tidak seburuk yg org2 bilang, negara lain jg udh punya sovereign wealth fund nya masing2 indonesia termasuk telat, lagi2 ini kyk mbg juga, kl dieksekusi dgn tepat bisa jd game changer indonesia","1909366253720146272","","pensivepsyche","in","","0","1","0","https://x.com/pensivepsyche/status/1909366253720146272","1377803791857111041","pensivepsyche"
"1909283832114954396","2025-04-07T22:00:35.000Z","0","@ErsaTriWahyuni Prabowo menyajikan 3 hal untuk antisipasi resesi: mbg, danantara dan hilirisasi. Perfect? Maybe no... Apakah ada usulan? Silahkan aja usul. Bagi saya Prabowo harus hati hati melangkah. Dia ngomong ndasmu aja banyak yang heboh.","1909365715909636561","","edwinsaragih","in","","0","0","0","https://x.com/edwinsaragih/status/1909365715909636561","30941494","edwinsaragih"
"1909364578343149832","2025-04-07T21:56:04.000Z","7","Dari segala jawaban pak pres yg bikin saya paling HAH:
- Gk ada belasungkawa sm rakyat yg digebuk aparat sampe operasi
- Komentar soal koruptor thailand di danantara
Kok bisa seorang presiden ngomong ""gamau ikut campur urusan negara lain.""
LAH??? JABATAN ANDA KEPALA NEGARA????","1909364578343149832","","","in","","0","1","2","https://x.com/Leobebbe/status/1909364578343149832","93560205","Leobebbe"
"1909345986776072308","2025-04-07T21:55:39.000Z","0","Danantara
- Harus visible dalam pengerjaannya.
- Mendanai proyek hilirisasi.
- Dampak Trump Tarif -&gt; Indonesia harus berdikari.
- Memperlihatkan ada anak (PS08) yang sangat bangga bisa merealisasikan cita cita bapaknya.

Private Sector
- Jawaban muter-muter dan normatif.","1909364473372328320","","celotehdiam","in","","0","0","0","https://x.com/celotehdiam/status/1909364473372328320","980107992","celotehdiam"
"1909345986776072308","2025-04-07T21:55:38.000Z","0","Penciptaan Lapangan Kerja
- Pemerintah optimis lapangan kerja tercipta lewat program MBG, Danantara, Koperasi Desa, dan 3 juta rumah per tahun.
- Lapangan kerja banyak tapi bukan kerja enak di ibukota dan ber-AC.
- Para sarjana jadi motor ekonomi di desa dengan kerja di desa.","1909364468196557182","","celotehdiam","in","","0","1","0","https://x.com/celotehdiam/status/1909364468196557182","980107992","celotehdiam"
"1909364369999511625","2025-04-07T21:55:14.000Z","0","Tapera, danantara, pajak 12% apalah

Kenapa ga via judol aja goblok

Gue ga mau bantuin lo!!!

@SriMulyani1009 cs","1909364369999511625","","","in","","0","0","0","https://x.com/aespacarku/status/1909364369999511625","229340809","aespacarku"
"1909180599551852716","2025-04-07T21:53:40.000Z","2","@ARSIPAJA Omongan pamungkas cm danantara, mbg dan hilirisasi. Ga ada solusi lain","1909363975680397658","","ARSIPAJA","in","","0","0","0","https://x.com/Alfa_Bimas/status/1909363975680397658","1726031471205588992","Alfa_Bimas"
"1909090393603621319","2025-04-07T21:29:54.000Z","1","@KompasTV Kasus besar korupsi diungkap karena mau jalanin kasus mega korupsi 14000 trilyun danantara 😅","1909357993076179386","","KompasTV","in","","0","0","0","https://x.com/TembaKanaeru/status/1909357993076179386","1588001931121033216","TembaKanaeru"
"1909354806415901168","2025-04-07T21:17:14.000Z","0","Danantara ngga diomongin nih? Padahal efisiensi kemarin cuma dikit buat MBG. Hadeeeh","1909354806415901168","","","in","","0","0","0","https://x.com/halzyonsky/status/1909354806415901168","966932583379484672","halzyonsky"
"1909353249024647471","2025-04-07T21:11:03.000Z","0","Ngomongin berdikari, danantara… noh dewas danantara aseng semua 😭 ga ngaca ih, kzl…","1909353249024647471","","","in","","0","0","0","https://x.com/irumeria/status/1909353249024647471","57884426","irumeria"
"1909211989882069096","2025-04-07T20:52:42.000Z","0","@ilhampid Legacy jokowi &gt; utang luar negri &gt; utang sama rakyat (sbn) &gt; sampe asset2 pasir sendimen pun dijual &gt; prabowo mencoba gembling dgn danantara &gt; dgn proteksi membuat ruu tni dan polri bisa membungkam rakyat &gt; klo danantara gagal setidak kerusuhan bs direndam.","1909348630122971635","","ilhampid","in","","0","0","0","https://x.com/Kamanov5/status/1909348630122971635","1393582611222597636","Kamanov5"
"1909348341978402907","2025-04-07T20:51:33.000Z","0","Gimana gk demo, efensiensi anggaran yang masuk ke Danantara ehee malam mantan koruptor masuk dibagian itu 😎","1909348341978402907","","","in","","0","0","0","https://x.com/Gagasons/status/1909348341978402907","1554440028264480770","Gagasons"
"1909261163428503856","2025-04-07T20:47:17.000Z","0","@wordfangs yg jelas bagi beliau cuma MBG, Danantara sama Dirinya. SISANYA GAK JELAS","1909347269478105561","","wordfangs","in","","0","0","0","https://x.com/bungkikal99/status/1909347269478105561","1476899351012143104","bungkikal99"
"1909345986776072308","2025-04-07T20:42:14.000Z","0","6. Harga sembako cenderung stabil menjelang lebaran (kecuali cabai).
7. Program-program pemerintah: Danantara, medcheck up gratis, data tunggal sosial ekonomi nasional, penurunan biaya ibadah haji, peningkatan gaji para buruh.","1909345998146764851","","celotehdiam","in","","0","1","0","https://x.com/celotehdiam/status/1909345998146764851","980107992","celotehdiam"
"1909345846417932584","2025-04-07T20:41:38.000Z","0","makan siang gratis sama danantara. lama-lama kalo ada pandemi di seluruh dunia lagi dia bakal jawab ""MBG.... Danantara..."" gitu doang.","1909345846417932584","","","in","","0","0","0","https://x.com/grebekwarkop/status/1909345846417932584","1816831813941362688","grebekwarkop"
"1908744071725928527","2025-04-07T20:29:11.000Z","0","@fahrisalam Belom Duit Danantara nih.","1909342714661081479","","fahrisalam","in","","0","0","0","https://x.com/LetsGoParrhesia/status/1909342714661081479","279042696","LetsGoParrhesia"
"1909341542059589728","2025-04-07T20:24:32.000Z","0","Lo ngomong sama pendukung dia deh, jawabannya sama, pendemo dibayar, mahasiswa dihasut, ditunggangi asing (padahal dia sendiri yg masukin asing, beberapa problematik lg di Danantara) dan mereka setuju wkwkwkw emang satu tipe, dan mayoritas! Makannya menang, payah semua","1909341542059589728","","","in","","0","0","0","https://x.com/coolcatmeowww/status/1909341542059589728","1245184371666989056","coolcatmeowww"
"1909093660777492716","2025-04-07T20:22:39.000Z","0","@0xFuckCrypto @KompasTV created token 'kita memang harus berdikari, karena itu kita punya danantara' (ticker: danantara). deployed contract address is 0xa0dF7d649e88103a909d3aa98bb9629a695f2b73 – see more: https://t.co/hcHqFg6KJ2","1909341069059428858","","0xawit","in","","0","0","0","https://x.com/bankrbot/status/1909341069059428858","1864452692221022210","bankrbot"
"1909093660777492716","2025-04-07T20:22:08.000Z","0","@TrancheDeLune @KompasTV Pernyataan Prabowo soal kemandirian masuk akal di tengah tarif Trump 32%. Danantara bisa kurangi ketergantungan pasar asing, tapi butuh waktu. Diplomasi Indonesia efektif, meski ada risiko jangka pendek seperti PHK. https://t.co/eAzQ4h3sdK https://t.co/nNZvi532P2","1909340939241324917","https://pbs.twimg.com/media/Gmq54W5a0AAZoCX.jpg","TrancheDeLune","in","","0","0","0","https://x.com/grok/status/1909340939241324917","1720665183188922368","grok"
"1909180599551852716","2025-04-07T20:16:33.000Z","0","@hasbiyal_furqon @ARSIPAJA ..misalnya produk tambang, kan ada rencana Danantara dipakai untuk hilirisasi nike atau barang tambang lainnya. Yg lebih gak masuk akal kalau solusinya MGB, blast itu bener2 ga nyambung. Kadang Prabowo kalo beri pernyataan emang ngawur","1909339533835166147","","laksono25","in","","0","0","0","https://x.com/laksono25/status/1909339533835166147","369492998","laksono25"
"1909180599551852716","2025-04-07T20:14:14.000Z","0","@hasbiyal_furqon @ARSIPAJA memang gak nyambung bang. Mungkin Logika Prabowo seperti ini, memperkuat ekonomi yang mana tujuannya melepas ketergantungan dengan asing, atau dengan Danantara jika berhasil produk dalam negeri akan memberikan  nilai tambah yang mana bisa diekspor..","1909338951321895093","","mffntime","in","","0","2","0","https://x.com/laksono25/status/1909338951321895093","369492998","laksono25"
"1909093660777492716","2025-04-07T20:12:22.000Z","0","@KompasTV Hahaha danantara yg blm terbukti aja udh jd andelan. Presiden omon2","1909338483124322656","","KompasTV","in","","0","0","0","https://x.com/miftahmraz/status/1909338483124322656","198361289","miftahmraz"
