"conversation_id_str","created_at","favorite_count","full_text","id_str","image_url","in_reply_to_screen_name","lang","location","quote_count","reply_count","retweet_count","tweet_url","user_id_str","username"
"1898953772795084884","2025-03-10T04:27:14.000Z","0","Ga mood bgt gara2 per-cpns-an ini, muak semuak2nya sama kata2 efisiensi, mbg, danantara. Ujungnya yg kecil2 lagi yg kena 😔","1898953772795084884","","","in","","0","0","0","https://x.com/ibuibuaira/status/1898953772795084884","180726995","ibuibuaira"
"1899115179348296189","2025-03-10T15:08:37.000Z","0","palang pintu dan penjaganya bisa dibiayai danantara ga nih? @Gerindra","1899115179348296189","","","in","","0","0","0","https://x.com/kul_de_sak/status/1899115179348296189","170250676","kul_de_sak"
"1898636481474032077","2025-03-09T07:26:26.000Z","38","Semua BUMN Bakal Tunduk di Kendali Danantara Pada Akhir Maret https://t.co/SdWHE0Uibo","1898636481474032077","","","in","","4","12","9","https://x.com/CNNIndonesia/status/1898636481474032077","17128975","CNNIndonesia"
"1899058434076811361","2025-03-10T11:23:08.000Z","2","https://t.co/X4NEawU9j7

Tenang....
Udah ada DananTara
Pun juga pak @prabowo  sdh koordinasi dgn para konglomerat
InsyaAllah Aman... https://t.co/u7NEAVtwVB","1899058434076811361","https://pbs.twimg.com/ext_tw_video_thumb/1899058413684031488/pu/img/CYguwUp76JbTyqer.jpg","","in","","0","0","1","https://x.com/zultansyaiful/status/1899058434076811361","420271726","zultansyaiful"
"1898958865615790403","2025-03-10T04:47:29.000Z","0","potensi penggunaan ""Danantara"" sebagai sumber pendanaan (""mesin uang"")  dalam persiapan menghadapi pemilihan presiden (Pilpres) tahun 2029 di  Indonesia.","1898958865615790403","","","in","","0","0","0","https://x.com/pakar_ai/status/1898958865615790403","1585841318810394625","pakar_ai"
"1899130161012125983","2025-03-10T16:08:09.000Z","0","Sekarang gw semakin yakin kalo Danantara buatan Pak @prabowo adalah sebuah perampokan uang negara yang dilegalisasi.

#BubarkanDanantara","1899130161012125983","","","in","","0","0","0","https://x.com/nvn_hdyt/status/1899130161012125983","1603683953546006528","nvn_hdyt"
"1899135404563202423","2025-03-10T16:28:59.000Z","1","Momentum tepat bagi Bank Muhammadiyah utk menjaring Nasabah -nasabah Bank yg masuk dlm BPI DANANTARA. Mrk ini blm yakin keamanan dana mrk di Bank yg akan menjadi tulang punggung DANANTARA.","1899135404563202423","","","in","","0","0","0","https://x.com/ZAMHARIBASYIR1/status/1899135404563202423","1466221870294863873","ZAMHARIBASYIR1"
"1898996739992088832","2025-03-10T07:17:59.000Z","1","PRABOWO PASTIKAN TIM DANANTARA DIPILIH SECARA PROFESIONAL TIDAK ADA TITIP-TITIPAN https://t.co/bO2Q047hoC","1898996739992088832","https://pbs.twimg.com/media/GlqXeLNbYAAnCQk.jpg","","in","","0","2","0","https://x.com/derryakbr/status/1898996739992088832","1564385765773021185","derryakbr"
"1898987847073604026","2025-03-10T06:42:38.000Z","0","Tujuan Danantara mengoptimalkan kekayaan negara https://t.co/K5COogJC58","1898987847073604026","https://pbs.twimg.com/media/GlqPYIhaEAEehoH.jpg","","in","","0","0","0","https://x.com/carispertama/status/1898987847073604026","1555388092491567104","carispertama"
"1898987727569530997","2025-03-10T06:42:10.000Z","0","Tidak ada titipan dalam kepengurusan danantara https://t.co/R9okN1IoCA","1898987727569530997","https://pbs.twimg.com/media/GlqPREZaEAAqrJY.jpg","","in","","0","0","0","https://x.com/carispertama/status/1898987727569530997","1555388092491567104","carispertama"
"1898987809664585793","2025-03-10T06:42:29.000Z","0","Prabowo pastikan tim danantara dipilih secara profesional https://t.co/YCF7yH8g4k","1898987809664585793","https://pbs.twimg.com/media/GlqPVp-aEAA-m7T.jpg","","in","","0","0","0","https://x.com/carispertama/status/1898987809664585793","1555388092491567104","carispertama"
"1898987767532863693","2025-03-10T06:42:19.000Z","0","Danantara sebagai kekuatan yang menunjang perekonomian Indonesia https://t.co/BQhZepHwyy","1898987767532863693","https://pbs.twimg.com/media/GlqPTUWbcAABqs-.jpg","","in","","0","0","0","https://x.com/carispertama/status/1898987767532863693","1555388092491567104","carispertama"
"1898987679381172491","2025-03-10T06:41:58.000Z","1","Prabowo Bakal Bangun Kilang Minyak Raksasa, Modalnya dari Danantara https://t.co/izMmbLFwmY","1898987679381172491","https://pbs.twimg.com/media/GlqPORZbMAAsfg4.jpg","","in","","0","0","0","https://x.com/carispertama/status/1898987679381172491","1555388092491567104","carispertama"
"1898976485324845418","2025-03-10T05:57:30.000Z","1","Smlm jg ada bapak² habis terawe bahas danantara
Pengen nimbrung, tp sayang lagi low social battry","1898976485324845418","","","in","","0","0","0","https://x.com/tutifrutty/status/1898976485324845418","2211378859","tutifrutty"
"1898995055261864022","2025-03-10T07:11:17.000Z","0","Presiden Prabowo Subianto ajak Ray Dalio, investor global, dan konglomerat bahas pengelolaan BPI Danantara di Istana Merdeka. Fokus pada dampak pasar dan transisi energi hijau.
https://t.co/7F6L3hRoGX","1898995055261864022","","","in","","0","0","0","https://x.com/sr_demo_agent/status/1898995055261864022","1881178526621306880","sr_demo_agent"
"1899123247482089983","2025-03-10T15:40:40.000Z","0","*Danantara dan Audit BPK: Kekhawatiran akan Independensi dan Dampaknya*

https://t.co/Wpw082MgBb","1899123247482089983","","","in","","0","0","0","https://x.com/romyfanboy/status/1899123247482089983","1450818985503571969","romyfanboy"
"1899031990718140796","2025-03-10T12:00:24.000Z","3","@Aswicahyono @bhres_ Mirip.

Vietnam akan bangun 1 jt affordable houses. Total populasi 100jt.

Indonesia akan bangun 3 jt rumah subsidi. Total populasi 280jt. 

Bedanya di Indo, yg akan bangun full Danantara 😁","1899067813899440150","","Aswicahyono","in","","0","0","2","https://x.com/gg_02022020/status/1899067813899440150","1209196396374417409","gg_02022020"
"1898945777743090051","2025-03-10T03:55:28.000Z","0","niat hati mau menabung, tapiii...

nabung emas, eh emasnya palsu. 
nabung di properti, eh ada mafia tanah.
nabung di bank, ahh ada danantara.
nabung dirumah, was2 ada maling masuk. 

🤣🤣🤣","1898945777743090051","","","in","","0","1","0","https://x.com/langsungya/status/1898945777743090051","1167689046803378176","langsungya"
"1898937175317860619","2025-03-10T03:21:17.000Z","0","Gimana Danantara mau sukses kalau bersih-bersih cm omon-omon","1898937175317860619","","","in","","0","0","0","https://x.com/politikana/status/1898937175317860619","18660644","politikana"
"1899215875796033801","2025-03-10T21:48:45.000Z","0","Pake danantara?","1899215875796033801","","","in","","0","0","0","https://x.com/istiqqq_/status/1899215875796033801","282579318","istiqqq_"
"1899096535746682946","2025-03-10T13:54:32.000Z","0","Diundur karena efisiensi, uangnya ngalir ke danantara. Nanti yg buat tameng mbg.

Udah gitu gitu aja polanya negeri ini","1899096535746682946","","","in","","0","0","0","https://x.com/hihello_26/status/1899096535746682946","1201838162118508548","hihello_26"
"1899077099421605892","2025-03-10T12:37:18.000Z","0","Danantara lah, kan ini bagian dari efisiensi 😀","1899077099421605892","","","in","","0","0","0","https://x.com/chocolatyaa/status/1899077099421605892","1446058219986571266","chocolatyaa"
"1898991119482159536","2025-03-10T06:55:39.000Z","0","Prabowo undang Haji Isam &amp; Chairul Tanjung ke Istana bahas strategi Danantara demi investasi nasional yang lebih kompetitif. Simak pembahasan lengkapnya di bawah ini! #idncitizen #promedia
https://t.co/G5xI7Bbgyb","1898991119482159536","","","in","","0","0","0","https://x.com/idn_citizen/status/1898991119482159536","1702957163059257344","idn_citizen"
"1898981085188653247","2025-03-10T06:15:46.000Z","0","Prabowo gandeng investor global dan pengusaha nasional untuk perkuat Danantara dalam investasi aset negara. Seperti apa strategi yang dibahas? Simak selengkapnya di bawah ini! #idncitizen #promedia
https://t.co/mFBzTV1eIc","1898981085188653247","","","in","","0","0","0","https://x.com/idn_citizen/status/1898981085188653247","1702957163059257344","idn_citizen"
"1899185181556421061","2025-03-10T19:46:47.000Z","7","di bukunya ""paradoks indonesia &amp; solusinya"", 08 sebut 1 permen (peraturan menteri), yaitu permen ttg Koperasi Multi Pihak, yaitu koperasi yg tidak 1 anggota 1 suara. bisa saja danantara sbg anggota koperasi desa merah putih &amp; simpatisan 08 sbg pengurus koperasi tsb.","1899185181556421061","","","in","","0","1","1","https://x.com/ketertibanumum/status/1899185181556421061","1589064114646589445","ketertibanumum"
"1898975831919300846","2025-03-10T05:54:54.000Z","0","CEO Danantara: Uang Nasabah Bank BUMN Tidak Akan Digunakan untuk Investasi 
https://t.co/Jd0VIf8UUd
#Danantara #RosanRoeslani #InvestasiBUMN #DividenBUMN #EkonomiIndonesia #HashimDjojohadikusumo #bitvonline","1898975831919300846","","","in","","0","0","0","https://x.com/officialbitv/status/1898975831919300846","1641028826489823232","officialbitv"
"1899233007145525383","2025-03-10T22:56:49.000Z","6","Pertumbuhan ekonomi secara fundamental dipengaruhi kualitas institusi. Regulator dipegang pemerintah hasil dari kompromi elites ParPol. Selama ParPol dikelola seperti usaha keluarga tanpa meritokrasi ya mustahil pertumbuhan ekonomi mencapai 8% walau didoping Danantara.

@prabowo","1899233007145525383","","","in","","0","0","4","https://x.com/Yang_MuliaPAP/status/1899233007145525383","611413509","Yang_MuliaPAP"
"1899230948178424006","2025-03-10T22:48:38.000Z","18","Danantara tidak pakai uang masyarakat , tapi dari APBN yg berasal dari pajak yg dibayar oleh rakyat.

Efisiensi anggaran dari Kementerian/Lembaga Rp.300 Triliun yg dimasukkan ke Danantara, didalamnya ada uang rakyat yg berasal dari pajak.
 https://t.co/tFNJwxMJrG","1899230948178424006","","","in","","0","5","7","https://x.com/DoankWarto/status/1899230948178424006","938664737369341952","DoankWarto"
"1899090068360581423","2025-03-10T13:28:50.000Z","2","Phk massal&gt;presiden bilang ngasi thr buat ojol&gt;orang"" beralih jadi ojol&gt;masyarakat gada duit buat ngojol, beralih naik skate&gt;perusahaan ojol gada wang buat bayar ojolnya&gt;perusahaan ojol diakusisi negara&gt; duitnya jadi danantara&gt;dikorupsi&gt;Phk massal&gt;hitler bangkit dari kubur&gt;soeha","1899090068360581423","","","in","","0","0","0","https://x.com/icangism_/status/1899090068360581423","1124204197526687744","icangism_"
"1899093896942215467","2025-03-10T13:44:03.000Z","0","Danantara lah, pake nanya","1899093896942215467","","","in","","0","0","0","https://x.com/achmads23/status/1899093896942215467","116176511","achmads23"
"1899111083371282627","2025-03-10T14:52:20.000Z","0","Waspada orang asing.....

Yang di danantara orang pedalaman kok. 😂😂","1899111083371282627","","","in","","0","0","0","https://x.com/nursalr/status/1899111083371282627","1446267349","nursalr"
"1899062596231463071","2025-03-10T11:39:40.000Z","0","Untuk mengurangi berita Danantara, Pertamina, Antam, LPEI, Timah, PLN dan lain2... Banyak.. Sangat banyak yg lain...

Gila.. Benar2 gila negara ini dipimpin Jokowi... Dan sialnya dia tau korupsi itu... tp diam... Bajingan... Bajingan...","1899062596231463071","","","in","","0","0","0","https://x.com/sinagano2/status/1899062596231463071","1548994272808304642","sinagano2"
"1899197127911158055","2025-03-10T20:34:15.000Z","0","Prabowo Tugasi Danantara Evaluasi Proyek Hilirisasi #mcinewsid #danantara #bpidanantara #dayaanagatanusantara #proyekhilirisasi #ratasdanantara https://t.co/2PaB3j3H1D","1899197127911158055","","","in","","0","0","0","https://x.com/mcinewsid/status/1899197127911158055","1898989765539819521","mcinewsid"
"1899128700844855733","2025-03-10T16:02:21.000Z","3","Seyogianya Danantara Jangan Dulu Investasi Disektor Investasi Sektor Industri Butuh Modal Besar, dan Pengembalian Jangka Panjang Dalam Situasi Ekonomi Domestik dan Global Yang Tidak Menentu. Sangat Riskan Sekali. Karena Danantara Baru Berdiri. https://t.co/6csRCucQT8","1899128700844855733","","","in","","0","0","0","https://x.com/machrilmachril1/status/1899128700844855733","1605727475694125058","machrilmachril1"
"1897979241607946313","2025-03-07T11:54:48.000Z","24","Prabowo Minta Nasihat Ray Dalio soal Ekonomi Global hingga Danantara https://t.co/w8kFpeCWq5","1897979241607946313","","","in","","1","12","5","https://x.com/CNNIndonesia/status/1897979241607946313","17128975","CNNIndonesia"
"1899005507500708122","2025-03-10T07:52:49.000Z","1","Demi Danantara semua dikorbankan.

Masa bodoh rakyat.","1899005507500708122","","","in","","0","0","1","https://x.com/Om_HME/status/1899005507500708122","1098015609499971584","Om_HME"
"1898358053776331185","2025-03-08T13:00:04.000Z","2","Chief Operation Officer (COO) Badan Pengelola Investasi Daya Anagata Nusantara (BPI Danantara), Dony Oskaria mengatakan semua Badan Usaha Milik Negara (BUMN) akan bergabung pada akhir Maret 2025.

Dony menyebut, saat ini sedang dilakukan proses pengalihan atau inbreng kepemilikan https://t.co/6pFldRHJs2","1898358053776331185","https://pbs.twimg.com/media/GlhSlENWwAAwf0x.jpg","","in","","2","5","4","https://x.com/VIVAcoid/status/1898358053776331185","41730943","VIVAcoid"
"1899211651678888087","2025-03-10T21:31:58.000Z","16","Lawan perusak konstitusi ? Siapa yang dimaksud Pak @SBYudhoyono ? Apakah sesama dewan penasihat di Danantara Pak ? 😴

Towel Pak @prabowo https://t.co/2rpQcYOKFj","1899211651678888087","https://pbs.twimg.com/media/Glta7i-b0AADSCn.jpg","","in","","0","3","6","https://x.com/hipohan/status/1899211651678888087","227320530","hipohan"
"1899184042475655179","2025-03-10T19:42:15.000Z","0","Danantara Ditugasi Evaluasi Menyeluruh Proyek Hilirisasi https://t.co/0IzmAbSYsd","1899184042475655179","","","in","","0","0","0","https://x.com/Alonesiacom/status/1899184042475655179","1442722911475814408","Alonesiacom"
"1897513092202053971","2025-03-06T05:02:29.000Z","2","Bos Mandiri Bantah Dana Masyarakat Bakal Dipakai untuk Danantara https://t.co/r1nk7mVnys","1897513092202053971","","","in","","0","1","1","https://x.com/CNNIndonesia/status/1897513092202053971","17128975","CNNIndonesia"
"1898989689350349079","2025-03-10T06:49:58.000Z","15","Bos Danantara Janji Tak Pakai Tabungan Nasabah Bank untuk Investasi
https://t.co/z9qMvt7NCT","1898989689350349079","","","in","","8","20","2","https://x.com/cnbcindonesia/status/1898989689350349079","847372542830444544","cnbcindonesia"
"1899105697373245450","2025-03-10T14:30:56.000Z","0","Malahan Tim Danantara ada unsur dari mantan napi Koruptor ...","1899105697373245450","","","in","","0","0","0","https://x.com/ilham22091985/status/1899105697373245450","3312076484","ilham22091985"
"1899052807178838221","2025-03-10T11:00:46.000Z","0","Indonesian Climate Justice: DME Batu Bara 'Solusi Palsu' Alternatif LPG https://t.co/IHyHcPOnSs . '

#Danantara
#DanantaraStopDanaiBatubara","1899052807178838221","","","in","","0","0","2","https://x.com/cak_daus/status/1899052807178838221","53009638","cak_daus"
"1899248838332088498","2025-03-10T23:59:44.000Z","7","Usulkan Danantara Investasi Pabrik Sawit, Legislator @akang_hero: Ini Demi Petani Sawit

https://t.co/lqYXCrol1e","1899248838332088498","","","in","","0","1","2","https://x.com/soeyoto1/status/1899248838332088498","376007525","soeyoto1"
"1898963517765820928","2025-03-10T05:05:58.000Z","1","Danantara Masuk 10 Besar Badan Investasi Dunia 

#Danantara https://t.co/YbDgnlrQsj","1898963517765820928","https://pbs.twimg.com/media/Glp5QVcbcAAMBft.jpg","","in","","0","1","0","https://x.com/kharism79/status/1898963517765820928","1564436564855234560","kharism79"
"1897996880187211803","2025-03-07T13:04:53.000Z","7","Semua BUMN Masuk Danantara pada Akhir Maret, Termasuk yang Merugi https://t.co/aOVf8UAVAp","1897996880187211803","","","in","","1","0","0","https://x.com/CNNIndonesia/status/1897996880187211803","17128975","CNNIndonesia"
"1898963117234880963","2025-03-10T05:04:22.000Z","2","Rosan Ungkap Sektor yang Jadi Fokus Investasi Danantara https://t.co/owVtUv1ASw","1898963117234880963","","","in","","0","1","2","https://x.com/CNNIndonesia/status/1898963117234880963","17128975","CNNIndonesia"
"1899015982070579648","2025-03-10T08:34:26.000Z","0","Bedah websitenya danantara bikin sakit hati anjir, lebih-lebih dari coretax, sumpah demi apapun enterprise yang ngelola investasi belasan ribu triliun tapi webnya… … …

Astaghfirullah, Ya Allah Allahuakbar","1899015982070579648","","","in","","0","1","0","https://x.com/mamzkky/status/1899015982070579648","375363804","mamzkky"
"1899073886228029919","2025-03-10T12:24:32.000Z","1","Kita setuju apapun program pemerintah utk mendukung pertumbuhan ekonomi 8%, termasuk danantara, catatannya, jangan ada pejabat politik yang menjdj nakhodanya. Diambil yang profesional, punya sikap tegas dan amanah. Kasus lembaga keu banyak yang diakali dengan investasi bodong","1899073886228029919","","","in","","0","0","0","https://x.com/marzukialie_MA/status/1899073886228029919","208784759","marzukialie_MA"
"1897290879515431271","2025-03-05T14:19:30.000Z","69","Rosan Roeslani mengatakan, Presiden Prabowo menitipkan pesan agar tak ada titipan dalam struktur Danantara.

https://t.co/vCWfMDs8m7","1897290879515431271","","","in","","20","156","12","https://x.com/detikcom/status/1897290879515431271","69183155","detikcom"
"1899037261863239810","2025-03-10T09:59:00.000Z","5","Alih-Alih Diakusisi Danantara, Sarmuji Usul Eks Karyawan Sritex Dikaryakan Pemerintah Sesuai Keahlian
#bahlillahadalia #kuningkeren #golkarindonesia #partaigolkar #golkarpedia
https://t.co/jMOFiWc2YO","1899037261863239810","","","in","","0","0","38","https://x.com/golkarpedia/status/1899037261863239810","721898354502930433","golkarpedia"
"1897871897733612027","2025-03-07T04:48:15.000Z","0","Erick-Rosan Dipanggil Prabowo ke Istana, Bahas Pengurus Danantara? https://t.co/7biLn4808e","1897871897733612027","","","in","","0","0","1","https://x.com/CNNIndonesia/status/1897871897733612027","17128975","CNNIndonesia"
"1898993571799367750","2025-03-10T07:05:23.000Z","0","Setelah anaknya jadi menteri di era Jokowi dan di era rezim prabowo, lalu dpt posisi di danantara,,,🤦","1898993571799367750","","","in","","0","0","0","https://x.com/LaiElfrid/status/1898993571799367750","1978790995","LaiElfrid"
"1898943453096284395","2025-03-10T03:46:14.000Z","19","Pemerintah memastikan dana Danantara untuk investasi berasal dari dividen BUMN, bukan dari masyarakat. Simak pernyataannya: https://t.co/uNZzdptRpw","1898943453096284395","","","in","","1","51","3","https://x.com/detikcom/status/1898943453096284395","69183155","detikcom"
"1899001121064268170","2025-03-10T07:35:23.000Z","0","Pak Beye @SBYudhoyono ,yakin mau melawan perusak konstitusi ?? Kmaren pas peresmian Danantara aja sampeyan satu frame yg sama2 jadi penasehat dilembaga baru itu ? Dan yg kami lihat Presiden Prabowo sangat takzim membungkukkan badanya kpd perusak konstitusi tsb.","1899001121064268170","","","in","","0","1","0","https://x.com/DImmortha/status/1899001121064268170","1383835282462576646","DImmortha"
"1899052083355042287","2025-03-10T10:57:54.000Z","0","RBB seleksi seribet itu taunya ada yg 'cuman' pegawai kontrak, modal dikit kek... kan udh ada danantara","1899052083355042287","","","in","","0","3","0","https://x.com/penicillien/status/1899052083355042287","1071595320079872000","penicillien"
"1899021547958132895","2025-03-10T08:56:33.000Z","0","Formasi Lengkap Pengurus Danantara Akan Segera Diumumkan, Pekan Ini?
https://t.co/i0vEIzB4pY","1899021547958132895","","","in","","0","0","0","https://x.com/cnbcindonesia/status/1899021547958132895","847372542830444544","cnbcindonesia"
"1899215506558922824","2025-03-10T21:47:17.000Z","0","Kenapa Pasar Modal bereaksi negatif pada Danantara? #danantara 
https://t.co/HZ6rKpwyuC","1899215506558922824","","","in","","0","0","0","https://x.com/worldview889/status/1899215506558922824","2725022456","worldview889"
"1899044991176962149","2025-03-10T10:29:43.000Z","0","BPI Danantara Masih Sele https://t.co/LdeQz50cTr https://t.co/Z5VksFEoVU","1899044991176962149","https://pbs.twimg.com/media/GlrDWtkWAAA9EnS.jpg","","in","","0","0","0","https://x.com/soloposdotcom/status/1899044991176962149","155169715","soloposdotcom"
"1899005809373352204","2025-03-10T07:54:01.000Z","2","AYO ANGKAT BURSAnya ... 
cnbc, BURSA RONTOK krn PRABOWO 

Menurut Goldman: Ketakutan investor asing terjadi setelah Prabowo mengumumkan  
- Inisiatif pemangkasan dan realokasi anggaran 
- pembentukan Danantara 
- program 3 juta rumah yg bisa membuat
   bengkak defisit anggaran.","1899005809373352204","","","in","","0","0","0","https://x.com/embahjsx/status/1899005809373352204","2899910497","embahjsx"
"1898965178827575467","2025-03-10T05:12:34.000Z","0","Danantara dikelola transparan, bisa diaudit siapapun #DanantaraPorosInvestasi https://t.co/g21h4qZuSE","1898965178827575467","https://pbs.twimg.com/media/Glp6gwYaoAAZDpo.jpg","","in","","0","1","0","https://x.com/gerbang_utama/status/1898965178827575467","3896382861","gerbang_utama"
"1899145501729251631","2025-03-10T17:09:06.000Z","0","melihat danantara ini mirip dengan cita-cita Badan Usaha Otorita IKN, tp kalo danantara versi lbh besarnya

Apakah hub. antara danantara dan BU Otorita IKN? Bisa jd buat danain IKN juga yaa, secara IKN investor gak ada yg minat 

 bisa jelasinkah? @BocorAlusPol @NarasiNewsroom","1899145501729251631","","","in","","0","0","0","https://x.com/alf_nadya/status/1899145501729251631","237612977","alf_nadya"
"1897998554393985508","2025-03-07T13:11:33.000Z","4","Undang Pengusaha Besar Indonesia ke Istana, Prabowo Paparkan seputar Danantara

https://t.co/s6NPAcxANn","1897998554393985508","","","in","","3","2","0","https://x.com/KompasTV/status/1897998554393985508","71436318","KompasTV"
"1899020030865502301","2025-03-10T08:50:32.000Z","1","Danantara Serahkan CV Ca https://t.co/jVSHvOfK0S","1899020030865502301","","","in","","0","0","0","https://x.com/kumparan/status/1899020030865502301","759692754985242625","kumparan"
"1898991381659496708","2025-03-10T06:56:41.000Z","0","Hardjuno Wiwoho Beber 3 Syarat Danantara Dipercaya Masyarakat, Salah Satunya Hukuman Mati Koruptor 
https://t.co/j0m2LOOMFc","1898991381659496708","","","in","","0","0","0","https://x.com/fajaronline/status/1898991381659496708","89877164","fajaronline"
"1897567117316125150","2025-03-06T08:37:10.000Z","4","Kepala Badan Pengelola Investasi (BPI) Danantara, Rosan Perkasa Roeslani, mengungkapkan bahwa Presiden Prabowo Subianto melarang Danantara memasukkan orang-orang titipan, tetapi harus merekrut orang-orang terbaik.

https://t.co/AiGnjkcY6a https://t.co/b4LZxOe59p","1897567117316125150","https://pbs.twimg.com/media/GlWDF2wa4AI75nR.jpg","","in","","0","2","0","https://x.com/kompascom/status/1897567117316125150","23343960","kompascom"
"1899222852530053597","2025-03-10T22:16:28.000Z","0","Danantara Ditugaskan Untuk Evaluasi Proyek Hilirisasi

https://t.co/xKUqwGzisa","1899222852530053597","","","in","","0","0","0","https://x.com/jpnncom/status/1899222852530053597","79130206","jpnncom"
"1899173412657840579","2025-03-10T19:00:01.000Z","0","Terungkap! Ray Dalio Sebut Tantangan Besar BPI Danantara: Korupsi dan Birokrasi

https://t.co/8Uqa18iHwI","1899173412657840579","","","in","","0","0","0","https://x.com/radaraktual/status/1899173412657840579","853782937782714368","radaraktual"
"1899218717948686534","2025-03-10T22:00:02.000Z","0","Pengamat: Berantas Korupsi untuk Tingkatkan Kepercayaan pada Danantara

https://t.co/8o7oYmNbWa","1899218717948686534","","","in","","0","0","0","https://x.com/radaraktual/status/1899218717948686534","853782937782714368","radaraktual"
"1899139614558003477","2025-03-10T16:45:43.000Z","0","Danantara itu bisa ngak diibaratkan kayak anak-anak dapet THR dari seseorang terus yang nyimpen mamanya.
Terus bilang: Nak Uangmu dititipin ke Mama dulu ya, nanti uangnya buat investasi terus nanti yang ngawasnya Papa kok.
Sementara papa takut sama mama
:)","1899139614558003477","","","in","","0","0","0","https://x.com/farukmuhamadc/status/1899139614558003477","281920672","farukmuhamadc"
"1898982550615552263","2025-03-10T06:21:36.000Z","12","Bibit Krisis Ekonomi: Danantara dan Pemangkasan Anggaran

https://t.co/tMBRqpUylr","1898982550615552263","","","in","","0","1","2","https://x.com/GunRomli/status/1898982550615552263","45602536","GunRomli"
"1899080569801081003","2025-03-10T12:51:05.000Z","0","Wamen BUMN Dony Oskaria Sebut Danantara Masih Seleksi terhadap Calon Pengurus https://t.co/xGVslzoPBE","1899080569801081003","","","in","","0","0","0","https://x.com/MediaVoi/status/1899080569801081003","1578222594","MediaVoi"
"1899059132553912795","2025-03-10T11:25:54.000Z","0","Pekan Depan Full Team, Danantara Sudah Serahkan CV Calon Pengurus ke Prabowo https://t.co/lCLuBQti8B","1899059132553912795","","","in","","0","0","0","https://x.com/MediaVoi/status/1899059132553912795","1578222594","MediaVoi"
"1898998952227221609","2025-03-10T07:26:46.000Z","0","Penundaan Pengangkatan CPNS hingga 7 Bulan Diduga karena Penerimaan Negara Minim Akibat Kegagalan Coretax dan Modal Danantara 
https://t.co/niYko6NZFG","1898998952227221609","","","in","","0","0","0","https://x.com/fajaronline/status/1898998952227221609","89877164","fajaronline"
"1898296380587962678","2025-03-08T08:55:00.000Z","0","Pemerintah Akan Bangun Kilang Berkapasitas 500.000 Barel di Sumatera, Sebagian Didanai Danantara

https://t.co/8eZE7qNPL1","1898296380587962678","","","in","","0","1","0","https://x.com/KompasTV/status/1898296380587962678","71436318","KompasTV"
"1898370620024566210","2025-03-08T13:50:00.000Z","4","Prabowo Undang Pengusaha Besar ke Istana, Strategi Atasi PHK dan Dukung Danantara?

https://t.co/JTGXI4ULG0","1898370620024566210","","","in","","2","2","1","https://x.com/KompasTV/status/1898370620024566210","71436318","KompasTV"
