"conversation_id_str","created_at","favorite_count","full_text","id_str","image_url","in_reply_to_screen_name","lang","location","quote_count","reply_count","retweet_count","tweet_url","user_id_str","username"
"1934960094850273301","2025-06-17T13:03:31.000Z","0","Realisasi Belanja MBG Capai Rp 4,4 T, Bakal Ditambah Rp 100 T https://t.co/VabVQmboUF","1934960094850273301","","","in","","0","0","0","https://x.com/detikfinance/status/1934960094850273301","135795460","detikfinance"
"1934558143360680422","2025-06-16T10:26:18.000Z","1","BGN melakukan Penandatanganan Nota Kesepahaman dengan Badan Percepatan Pengentasan Kemiskinan untuk pembangunan 1.000 dapur MBG di wilayah Tertinggal, Terjauh, dan Terluar (3T).

~MD #BGN #MBG https://t.co/9WSXE3IQLS","1934558143360680422","","","in","","0","0","0","https://x.com/kompascom/status/1934558143360680422","23343960","kompascom"
"1933097754479440260","2025-06-12T09:43:14.000Z","0","Pola makan bergizi seimbang yang diterapkan di sekolah melalui Program Makanan Bergizi Gratis (MBG) dinilai bisa menjadi contoh baik bagi orang tua dalam membiasakan anak mengonsumsi makanan sehat di rumah.

~MD #MBG #PolaMakan  https://t.co/2iagqhlrh2","1933097754479440260","","","in","","0","1","0","https://x.com/kompascom/status/1933097754479440260","23343960","kompascom"
"1934920910894715242","2025-06-17T10:27:48.000Z","2","Menurutnya, 60 persen anak Indonesia tidak mampu membeli susu dan kurang memiliki akses terhadap makanan bergizi seimbang.

~MD #MakanBergiziGratis #MBG #Kemiskinan https://t.co/gQ21LmVGpj","1934920910894715242","","","in","","0","1","0","https://x.com/kompascom/status/1934920910894715242","23343960","kompascom"
"1934882909829390519","2025-06-17T07:56:48.000Z","0","Wakil Menteri Pertanian (Wamentan) Sudaryono mengatakan, pemerintah membuka peluang bagi pengusaha lokal dan investor asing untuk membawa sapi hidup ke Indonesia.

~MD #InvestorAsing #MBG https://t.co/48eoHNuzLR","1934882909829390519","","","in","","0","0","0","https://x.com/kompascom/status/1934882909829390519","23343960","kompascom"
"1933049823349150125","2025-06-12T06:32:46.000Z","0","Anggaran sebanyak itu tidak hanya difokuskan ke Pulau Jawa, tetapi ke seluruh wilayah sehingga akan memunculkan simpul-simpul ekonomi baru hingga ke pelosok desa.

~MD #Prabowo #MakanBergiziGratis #MBG  https://t.co/UAiCbWBdYh","1933049823349150125","","","in","","0","0","0","https://x.com/kompascom/status/1933049823349150125","23343960","kompascom"
"1934558714624979275","2025-06-16T10:28:34.000Z","2","Kepala BGN Dadan Hindayana menyebutkan bahwa hingga saat ini pihaknya sudah mempekerjakan kurang lebih 68.000 pekerja di 1.785 unit Satuan Pelayanan Pemenuhan Gizi (SPPG).

~MD #MBG #SPPG #BGN https://t.co/SbY0aaNOGg","1934558714624979275","","","in","","0","1","0","https://x.com/kompascom/status/1934558714624979275","23343960","kompascom"
"1934536194144297237","2025-06-16T08:59:05.000Z","1","Kepala Badan Gizi Nasional (BGN) Dadan Hindayana mengungkapkan pemerintah membutuhkan kurang lebih 82,9 juta butir telur per hari untuk dikonsumsi. | #MakanBergiziGratis 

https://t.co/9WSXE3IQLS","1934536194144297237","","","in","","0","2","0","https://x.com/kompascom/status/1934536194144297237","23343960","kompascom"
"1934172778980376792","2025-06-15T08:55:00.000Z","2","Kemenimipas menjadikan dapur Lapas Sukamiskin jadi tempat memasak program Makan Bergizi Gratis. Para Napi pun memasak 3.444 porsi untuk dibagikan. https://t.co/w4ToE80GKo","1934172778980376792","","","in","","0","4","1","https://x.com/detikcom/status/1934172778980376792","69183155","detikcom"
"1934766692514558179","2025-06-17T18:46:59.000Z","0","@wakaramahen @ARSIPAJA Saya mengerti kekesalan Anda terhadap pernyataan Kepala BGN. Kebijakan menjual minyak jelantah dari program MBG untuk biofuel memang bertujuan mengurangi limbah dan mendukung energi terbarukan, sekaligus memberi pendapatan tambahan bagi SPPG. Namun, komunikasi yang kurang jelas","1935046533873025098","","wakaramahen","in","","0","0","0","https://x.com/grok/status/1935046533873025098","1720665183188922368","grok"
"1934964942412939490","2025-06-17T13:22:46.000Z","0","Klo di TK Eksperimental, menu MBG yg begitu snack2 an keluar pada saat puasa. Dan banyak diprotes mamak2. Tapi sekolah cukup koperatif, dikirim dulu ke group ortu, dan ortu berhak menolak dan ga usah dikasih ke anak. 
Klo abis puasa menu normal. 
Ini menu sebelum rapotan sei https://t.co/202TckHU58","1934964942412939490","https://pbs.twimg.com/media/GtpfJpjbwAApJC-.jpg","","in","","0","1","0","https://x.com/jazedw/status/1934964942412939490","147448841","jazedw"
