"conversation_id_str","created_at","favorite_count","full_text","id_str","image_url","in_reply_to_screen_name","lang","location","quote_count","reply_count","retweet_count","tweet_url","user_id_str","username"
"1912750774096130270","2025-04-17T10:24:47.000Z","8530","@TirtoID Kebijakan jelek : 

- MBG
- Danantara
- Penampungan Palestina
- UU TNI

Tidak membantu rakyat sama sekali. 
Terimakasih pak pres","1912814491265286596","","TirtoID","in","","33","34","1792","https://x.com/senandikatama/status/1912814491265286596","1549641109747294208","senandikatama"
"1912372707544690706","2025-04-16T05:09:18.000Z","17532","Salah satu dapur Makan Bergizi Gratis (MBG) di Kalibata, Pancoran, Jakarta Selatan, terpaksa berhenti beroperasi sejak akhir Maret 2025. 

Penyebabnya terkait dugaan penggelapan dana operasional oleh pihak pengelola dana, Yayasan Media Berkat Nusantara (MBN) yang hampir mencapai https://t.co/WAgVDEjf6L","1912372707544690706","https://pbs.twimg.com/media/GoocEU6WsAAHNds.jpg","","in","","1933","1165","5286","https://x.com/kompascom/status/1912372707544690706","23343960","kompascom"
"1912923116386603159","2025-04-17T17:36:25.000Z","1","Nonton raaes yg juga nyalon + ada mbg nya, ini film sebenernya bagus aja ngangkat banyak isu yg masih ada sampe skrng tp kenapa cerita raaesnya sendiri jelek sih😔 ga apa sad ending tp bisa ga dijelasin lebih dalem lagi https://t.co/50j9rC1cbG","1912923116386603159","https://pbs.twimg.com/media/GowRb8xa8AAEeR9.jpg","","in","","0","1","0","https://x.com/aleiproduktif/status/1912923116386603159","1533461673436409856","aleiproduktif"
"1912846662701359532","2025-04-17T12:32:38.000Z","295","Mitra Dapur Kalibata, Jaksel melaporkan Yayasan Makan Bergizi Gratis (MBG) berinisial MBN ke Kepolisian terkait dugaan penggelapan dana sebesar 975.375.000 atau hampir 1M. 

Sc :
🎥 vivacoid https://t.co/0L3X3ubDrf","1912846662701359532","https://pbs.twimg.com/amplify_video_thumb/1912846290238816256/img/2BGW7Z1RNREENvgK.jpg","","in","","6","28","163","https://x.com/MariaAlkaff_/status/1912846662701359532","77654478","MariaAlkaff_"
"1912340179437920607","2025-04-16T03:00:02.000Z","1695","Mitra Dapur Makan Bergizi Gratis (MBG) di Kalibata ungkapkan kronologi penggelapan yang dilakukan Yayasan MBN pada program makan gratis. https://t.co/GGRUkJQFYO","1912340179437920607","https://pbs.twimg.com/amplify_video_thumb/1912316385956380672/img/-eZCeRdEsSX0YVM8.jpg","","in","","254","203","974","https://x.com/detikcom/status/1912340179437920607","69183155","detikcom"
"1912856879518433564","2025-04-17T13:13:13.000Z","0","klo ngmgin MBG emosi gw langsung naik😠https://t.co/T5BV6ZGhZq","1912856879518433564","","","in","","0","0","0","https://x.com/DeviWisely/status/1912856879518433564","1329408710326685696","DeviWisely"
"1912875897918468553","2025-04-17T14:28:48.000Z","0","mereka bayar ginian berapa sih

mksdny kerja apa mereka https://t.co/0SqR5X5zHE","1912875897918468553","https://pbs.twimg.com/media/GovmfaubAAANeop.jpg","","in","","0","0","0","https://x.com/EximiusArtifex/status/1912875897918468553","1788652040799051776","EximiusArtifex"
"1912861093908865361","2025-04-17T13:29:58.000Z","8","“Program Bagus Butuh Tata Kelola yang Serius!”

Makan Bergizi Gratis (MBG) adalah program dengan niat mulia, tapi niat aja gak cukup. Tanpa tata kelola yang rapi, akurat, dan transparan, program sebagus apa pun bisa gagal di lapangan.

Kita sudah punya banyak contoh program yang https://t.co/x9O6BQm8wT","1912861093908865361","https://pbs.twimg.com/amplify_video_thumb/1912860212412952576/img/NAiRaO24Klq519-t.jpg","","in","","0","1","5","https://x.com/DPP_PKB/status/1912861093908865361","748953283","DPP_PKB"
"1913013651755413531","2025-04-17T23:36:11.000Z","1","Ngomong-ngomong soal MBG.
Ternyata, beberapa dari mereka gak mau makan itu.
Jadi pertanyaan baru, apakah dengan adanya MBG, ada banyak makanan yang dimakan/dibuang?
Kalo dimakan sih, ok.
Tapi kalo dibuang, akankah meningkatkan ancaman iklim?
https://t.co/SF56oZkfu1","1913013651755413531","","","in","","0","1","0","https://x.com/xtwentychepeen/status/1913013651755413531","827790478036709376","xtwentychepeen"
"1912866663491674164","2025-04-17T13:52:06.000Z","2","sepupu gw kelas 8, skrg lg nongkrong dpn rumah sm tmn tmn nya, mereka komplen menu mbg katanya basi dan ayamnya tulang doang💀","1912866663491674164","","","in","","0","2","0","https://x.com/tthkeonho/status/1912866663491674164","1054300825047130112","tthkeonho"
"1912349181479645350","2025-04-16T03:35:49.000Z","561","Salah satu dapur Makan Bergizi Gratis (MBG) di Kalibata terpaksa berhenti beroperasi sejak akhir Maret 2025.

/ #MakanBergiziGratis 
https://t.co/NX9Ab5MfIA","1912349181479645350","","","in","","51","81","264","https://x.com/kompascom/status/1912349181479645350","23343960","kompascom"
"1912854800233832802","2025-04-17T13:04:58.000Z","10","MBG bs buka lapangan kerja. Ente ga bayar gimana mau bayar ""peak""

Menu udah diberi tapi klen ga bayar, ya bangkrutlah vendornya.

Zalim sekali. Nyata Terlihat Kerjanya tapi ga mau bayar. https://t.co/vAZaKlwjau","1912854800233832802","https://pbs.twimg.com/media/GovTTZobQAA3Hc9.jpg","","in","","0","0","2","https://x.com/sharpandshark/status/1912854800233832802","1628338800362672128","sharpandshark"
"1912633669577290054","2025-04-16T22:26:16.000Z","40","Mitra dapur di Kalibata, Jakarta Selatan, melaporkan Yayasan Makan Bergizi Gratis (MBG) berinisial MBN ke Kepolisian terkait dugaan penggelapan dana hampir satu miliar atau sebesar Rp975.375.000.

Pengakuan Mitra Dapur MBG yang Tak Dibayar Hampir Rp 1 Miliar: Anggaran Setiap https://t.co/DSOdHB03zv","1912633669577290054","https://pbs.twimg.com/ext_tw_video_thumb/1912632959078928384/pu/img/h0zcDZIBvFR12GBE.jpg","","in","","8","21","29","https://x.com/VIVAcoid/status/1912633669577290054","41730943","VIVAcoid"
"1912892879078609067","2025-04-17T15:36:16.000Z","0","Hari tolol sedunia karena baca pemrentah udah siap2 mo nego buat menampung warga palestina, ditambah baca MBG nunggak 1M, blom macet tolol yg disebabkan loading kontainer, tolol tolol tolollll","1912892879078609067","","","in","","0","1","0","https://x.com/ranacuy/status/1912892879078609067","1017478661413326848","ranacuy"
"1912913719056863544","2025-04-17T16:59:05.000Z","0","Mana yang kemarin bilang MBG pondasi penting.","1912913719056863544","","","in","","0","0","0","https://x.com/usaegi/status/1912913719056863544","935431915280068609","usaegi"
"1912918485220642950","2025-04-17T17:18:01.000Z","0","Oalah yo yo, MBG lek M e diganti P (pistol) yaopo?","1912918485220642950","","","in","","0","0","0","https://x.com/sukiperr/status/1912918485220642950","2656344523","sukiperr"
"1913004019523723571","2025-04-17T22:57:54.000Z","19","Program MBG tidak hanya memberikan manfaat gizi, tetapi juga meningkatkan kebersamaan dan semangat belajar siswa, Dengan adanya perhatian khusus terhadap kebutuhan gizi anak, diharapkan perkembangan mereka semakin optimal. #MakanBergiziGratis #IndonesiaEmas #Kalbar https://t.co/QCT0wcyzvp","1913004019523723571","https://pbs.twimg.com/media/GoxbAwoa8AAGmGz.jpg","","in","","0","0","0","https://x.com/sinta2ponti/status/1913004019523723571","1448377734","sinta2ponti"
"1912876506822660435","2025-04-17T14:31:13.000Z","1","71 Triliun untuk 3 Juta Penduduk
17 Triliun untuk 18000 Lapangan Kerja (Pabrik BYD).

Mending MBG bener, org yg bilang MBG meres pajak ortu anak gila sih","1912876506822660435","","","in","","2","0","1","https://x.com/Garongbarbar/status/1912876506822660435","1880955900854427648","Garongbarbar"
"1912860706300657787","2025-04-17T13:28:26.000Z","0","Melalui Program Makan Bergizi Gratis, setiap anak Indonesia dijamin mendapatkan asupan yang sehat dan seimbang setiap harinya. #MBG #MakanBergiziGratis #AnakSehatBangsaKuat #GiziUntukSemua https://t.co/Jg6s8TmGY6","1912860706300657787","https://pbs.twimg.com/media/GovYrLkakAAI6zF.jpg","","in","","0","2","0","https://x.com/ayers_caid66545/status/1912860706300657787","1737796189020389376","ayers_caid66545"
"1912857424937226357","2025-04-17T13:15:23.000Z","0","Melalui Program Makan Bergizi Gratis, setiap anak Indonesia dijamin mendapatkan asupan yang sehat dan seimbang setiap harinya

#MBG #MakanBergiziGratis #AnakSehatBangsaKuat #GiziUntukSemua https://t.co/LB9Rh63IOZ","1912857424937226357","https://pbs.twimg.com/amplify_video_thumb/1912857368167321600/img/1M67WDU6tycLkQhR.jpg","","in","","0","0","0","https://x.com/Anniel4412/status/1912857424937226357","1583340527881441280","Anniel4412"
"1912857578998206638","2025-04-17T13:16:00.000Z","0","Ini bukan sekadar soal makan, ini tentang menciptakan generasi yang tumbuh dengan kuat, cerdas, dan siap menghadapi masa depan

#MBG #MakanBergiziGratis #AnakSehatBangsaKuat #GiziUntukSemua https://t.co/UbP9aHXBeb","1912857578998206638","https://pbs.twimg.com/amplify_video_thumb/1912857444214337536/img/EfzKMfJVyckZuw6Y.jpg","","in","","0","0","0","https://x.com/Anniel4412/status/1912857578998206638","1583340527881441280","Anniel4412"
"1912852118991749298","2025-04-17T12:54:18.000Z","0","Semua cendekiawan dan akademisi sudah teriak mengingatkan @prabowo soal program MBG yg ngawur dan bermasalah. https://t.co/XlTYvjOOdB","1912852118991749298","https://pbs.twimg.com/ext_tw_video_thumb/1912852083239510016/pu/img/7FtO5nhYC2WoNyie.jpg","","in","","0","0","0","https://x.com/bayud3wa/status/1912852118991749298","108906079","bayud3wa"
"1912843581385224464","2025-04-17T12:20:23.000Z","0","Update Distribusi Makan Bergizi Gratis ke 2.415 Siswa di Kabupaten Kepulauan Selayar   

Program Makan Bergizi Gratis (MBG) di Kabupaten Kepulauan Selayar kembali menunjukkan progres signifikan. Pada Rabu (16/4/2025), sebanyak   2.415 siswa   dari 10 sekolah telah menerima MBG. https://t.co/FzjLfBLP13","1912843581385224464","https://pbs.twimg.com/ext_tw_video_thumb/1912843223493693440/pu/img/NcARv2hP4OV0ez7f.jpg","","in","","0","0","0","https://x.com/Humaspolressel1/status/1912843581385224464","1398269992525713408","Humaspolressel1"
"1912756913055604778","2025-04-17T06:36:00.000Z","0","Semoga Program MBG terus berlanjut dan semakin banyak pihak yang ikut serta demi generasi yang lebih sehat dan ekonomi yang kuat https://t.co/eGpBIcZmgo","1912756913055604778","https://pbs.twimg.com/media/Got6RcbacAMRmPq.jpg","","in","","0","0","0","https://x.com/syfadewir/status/1912756913055604778","2782198327","syfadewir"
"1912790909152116795","2025-04-17T08:51:05.000Z","0","MBG pun masih menyisakan masalah. Udah maksa program lain 😭","1912790909152116795","","","in","","0","0","0","https://x.com/SI_Auo/status/1912790909152116795","1045157624407191552","SI_Auo"
"1912860093533897064","2025-04-17T13:26:00.000Z","0","Proyek SR menarik utk diikuti Krn potensi melehoy mirip MBG.
1. Pengadaan Lahan Sekolah
2. Pembangunan Sekolah
3. Rekrutmen guru nya
4. Biaya operasional sekolah yg bisa lebih besar dari sekolah negeri biasa Krn wacananya sekolah &amp; asrama (boarding school).","1912860093533897064","","","in","","0","0","0","https://x.com/SI_Auo/status/1912860093533897064","1045157624407191552","SI_Auo"
"1912801721220514211","2025-04-17T09:34:03.000Z","0","kotaku samsek gak ada tuh MBG 👀","1912801721220514211","","","in","","0","0","0","https://x.com/ssssssrgrace49/status/1912801721220514211","105040962","ssssssrgrace49"
"1912844793979576702","2025-04-17T12:25:12.000Z","1","Bhabinkamtibmas kelurahan Pandeyan Aiptu Nuryadi bersama Babinsa melaksanakan kegiatan pengamanan dan Monitoring Penyaluran Program Makan Bergizi Gratis (MBG) di sekolahan yang ada di wilayah Kelurahan Pandeyan. Kamis (17/4/2025). https://t.co/woi14TzSeM","1912844793979576702","https://pbs.twimg.com/media/GovKM_SaEAAKW6z.jpg","","in","","0","1","1","https://x.com/PolsekUH/status/1912844793979576702","1157832943072493568","PolsekUH"
"1912859680029937947","2025-04-17T13:24:21.000Z","0","cuih, mbg aja noh bayar","1912859680029937947","","","in","","0","0","0","https://x.com/CLstyles16_/status/1912859680029937947","1209501423739650048","CLstyles16_"
"1912877058683965752","2025-04-17T14:33:24.000Z","0","dan masih ada yg bilang ""program mbg kita mau ditiru banyak negara""

DELUSIONAL","1912877058683965752","","","in","","0","1","0","https://x.com/kroketpink/status/1912877058683965752","3267105902","kroketpink"
"1912864103775015021","2025-04-17T13:41:56.000Z","0","TOLAK RUU TNI!!!!!!","1912864103775015021","","","in","","0","0","0","https://x.com/fufuckfafa/status/1912864103775015021","1806140036225925120","fufuckfafa"
"1912865632338813050","2025-04-17T13:48:00.000Z","0","no words jir saking muaknya mbg mbg an","1912865632338813050","","","in","","0","0","0","https://x.com/callawee/status/1912865632338813050","1076705823731081216","callawee"
"1912891409574826286","2025-04-17T15:30:26.000Z","0","Ngeliat kotak mbg, kepikiran beli kotak bekel.","1912891409574826286","","","in","","0","0","0","https://x.com/sekuntumranum/status/1912891409574826286","47312884","sekuntumranum"
"1913014217625784733","2025-04-17T23:38:26.000Z","0","""... banyak negara lain ingin belajar dari program MBG ...""

Iya, ok, tp belajar itu ga selalu utk meniru. Belajar bisa jg utk menghindari permasalahan²nya, atau belajar utk menyedot anggaran negara 🤷‍♂️","1913014217625784733","","","in","","0","0","0","https://x.com/hideousrockstar/status/1913014217625784733","879977612","hideousrockstar"
"1912888571888906709","2025-04-17T15:19:09.000Z","0","Duh, Ulat Buah Ditemukan di Ompreng MBG di SMPN 1 Semarang https://t.co/KFp8qDzHVS https://t.co/9Iwol1dueJ","1912888571888906709","https://pbs.twimg.com/media/GovyBMkWAAAAJrz.jpg","","in","","0","0","0","https://x.com/Harian_Jogja/status/1912888571888906709","118371948","Harian_Jogja"
"1912518394055913718","2025-04-16T14:48:12.000Z","26","Badan Gizi Nasional (BGN) buka suara soal mitra dapur Makan Bergizi Gratis (MBG) di kawasan Kalibata, Pancoran, Jakarta Selatan, yang belum mendapatkan uang reimburse nyaris Rp 1 miliar dari yayasan berinisial MBN.

~LL #MBG #UangReimburse https://t.co/B7AMrlZ7fk","1912518394055913718","https://pbs.twimg.com/amplify_video_thumb/1912515530046513152/img/Wo5hhIqUUnpHvo3i.jpg","","in","","0","3","9","https://x.com/kompascom/status/1912518394055913718","23343960","kompascom"
"1912892903585972617","2025-04-17T15:36:22.000Z","0","ended mbg","1912892903585972617","","","en","","0","0","0","https://x.com/leviosatoru/status/1912892903585972617","1313856521650933761","leviosatoru"
"1912836962555408564","2025-04-17T11:54:05.000Z","1","Program Makan Bergizi Gratis bukan cuma soal makan. Ini tentang mencetak generasi kuat dan cerdas untuk masa depan Indonesia!
#MBG #MakanBergiziGratis #AnakSehatBangsaKuat #GiziUntukSemua https://t.co/1pQE2Por9v","1912836962555408564","https://pbs.twimg.com/media/GovDFF_aUAA0zaw.jpg","","in","","0","1","0","https://x.com/Nan4_ecia/status/1912836962555408564","1753991718452768769","Nan4_ecia"
"1912836883186634918","2025-04-17T11:53:46.000Z","1","MBG biar saja utk yg mau, jangan dipaksa....
Atau utk papua tidak perlu ada MBG ...

Program MBG di Papua Pegunangan Hanya untuk Sekolah Berasrama https://t.co/n6Rh6ZwSaG","1912836883186634918","","","in","","0","0","1","https://x.com/jari_droid/status/1912836883186634918","1486631613932834819","jari_droid"
"1912868049373548803","2025-04-17T13:57:36.000Z","0","Jumbo                      Komdigi MBG https://t.co/T8TAQXAEaM","1912868049373548803","https://pbs.twimg.com/media/GovfWlraIAE8QfY.jpg","","in","","0","0","0","https://x.com/Randomieshere/status/1912868049373548803","1772548778203164672","Randomieshere"
"1912752504359776689","2025-04-17T06:18:28.000Z","0","jd siapa yg masih mau belain mbg","1912752504359776689","","","in","","0","0","0","https://x.com/mengreilakan/status/1912752504359776689","1358410865297346565","mengreilakan"
"1912951057266938254","2025-04-17T19:27:27.000Z","0","Utangnya bayar dulu bos

Itu karyawan dapur mbg sampe ada yang makan sisa siswa loh","1912951057266938254","","","in","","0","0","0","https://x.com/eatreadrepeatt/status/1912951057266938254","1075694239386865667","eatreadrepeatt"
"1912837841329258758","2025-04-17T11:57:34.000Z","0","Doi kmaren keterima jadi staff MBG, aku sebenernya ga sreg (gatau firasat gw jlek bgt). Tp ak kan gabisa ngatur² ya🙂 kan kita belum siapa siapa. Jadi aku semangatin aja, udh aku kasih tau berita perihal pembayarannya. Dia udh tau, tp pengem coba kerja. Huft","1912837841329258758","","","in","","0","1","0","https://x.com/cocuuji/status/1912837841329258758","721516277156552704","cocuuji"
"1912841935712342145","2025-04-17T12:13:51.000Z","2","Komandan Kodim 0731/Kulon Progo Letkol Arh Viki Herwandi, S.Sos., didampingi Danramil 02/Temon Kapten Inf Triyono, peninjauan pelaksanaan program Makan Bergizi Gratis di Dapur MBG Mugi Berkah Lestari Karangwuluh Lor, Kalurahan Karangwuluh, Kapanewon Temon https://t.co/hkvatRwmzQ","1912841935712342145","https://pbs.twimg.com/media/GovHlyNbwAAsd_R.jpg","","in","","0","0","0","https://x.com/Korem072Pmk/status/1912841935712342145","3119462413","Korem072Pmk"
"1912876584878710893","2025-04-17T14:31:32.000Z","0","Tunggakan dapur MBG sudah dilunasin blm pak? sudah?","1912876584878710893","","","in","","0","0","0","https://x.com/trymakasyh/status/1912876584878710893","514097978","trymakasyh"
"1912836477177766081","2025-04-17T11:52:09.000Z","1","Pihak yayasan hanya jadi makelar alias jasa perantara ...
Enak sekali mereka...harusnya dari BGN langsung ke katering...
@prabowo
@Gerindra
Ternyata Ini Alasan Yayasan Tak Bayar Mitra MBG di Kalibata Hampir Rp 1 Miliar, padahal Uang Sudah di Tangan

 https://t.co/fVZQUsPyhe","1912836477177766081","","","in","","0","0","1","https://x.com/jari_droid/status/1912836477177766081","1486631613932834819","jari_droid"
"1912877160182038813","2025-04-17T14:33:49.000Z","0","udahlah anjir bubar aja mbg ini, dananya mending disalurin ke pendidikan / kesehatan yang lebih ada manfaatnya... ya Allah aku berlindung kepadaMu dari pemimpin bodoh 😔😔","1912877160182038813","","","in","","0","0","0","https://x.com/hjirotaka/status/1912877160182038813","1528962986634686466","hjirotaka"
"1912962893919994013","2025-04-17T20:14:29.000Z","0","wkwk hai, mbg mu yang nggak seberapa itu masih ngutang neh belom dibayar xixixi","1912962893919994013","","","in","","0","1","0","https://x.com/cookiiee_eee/status/1912962893919994013","982262727572799488","cookiiee_eee"
"1912826512728052167","2025-04-17T11:12:33.000Z","0","Bangun dapur mbg nya tiap kota di korupsi wkwkwkwk #ytta","1912826512728052167","","","in","","0","0","0","https://x.com/yourcutebaby_/status/1912826512728052167","1122222139967361024","yourcutebaby_"
"1912846301420474653","2025-04-17T12:31:11.000Z","1","Bhabinkamtibmas kelurahan Sorosutan Aiptu Ali Mashadi melaksanakan kegiatan pengamanan dan Monitoring Penyaluran Program Makan Bergizi Gratis (MBG) di sekolahan yang ada di wilayah Kelurahan Sorosutan. Kamis (17/4/2025). https://t.co/xOleDYKLw6","1912846301420474653","https://pbs.twimg.com/media/GovLkvQacAAkTGc.jpg","","in","","0","1","1","https://x.com/PolsekUH/status/1912846301420474653","1157832943072493568","PolsekUH"
"1912863305162772954","2025-04-17T13:38:45.000Z","0","Solusinya: naikan gajinnya dan MBG","1912863305162772954","","","in","","0","0","0","https://x.com/donecorner/status/1912863305162772954","1838798964340199424","donecorner"
"1912886962459185324","2025-04-17T15:12:46.000Z","0","Kanit Binmas Polsek Muara Batang Gadis Aipda Ariadi dan Babinsa Koramil 17 Natal Kopda Warso melaksanakan Patroli dan Silaturahmi dengan Kepala Desa Sikapas Kec. Muara Batang Gadis Kab. Madina sekaligus menyampaikan pesan-pesan Kamtibmas, di Kediaman Kepala Desa Sikapas. https://t.co/rXjyZ9MLDL","1912886962459185324","https://pbs.twimg.com/media/Govwi0IbUAAki_z.jpg","","in","","0","0","0","https://x.com/polsek_mbg/status/1912886962459185324","1909125492818731008","polsek_mbg"
"1912998787418886456","2025-04-17T22:37:07.000Z","0","presiden yang sekarang apapun masalahnya mbg solusinya","1912998787418886456","","","in","","0","0","0","https://x.com/kisaarchivee/status/1912998787418886456","1309021636411166726","kisaarchivee"
"1912809306698993974","2025-04-17T10:04:11.000Z","0","""Realisasi MBG Rp1,44T (2,04% dari pagu Rp71T) per 16 April 2025. Target naik jadi Rp2T akhir April, Rp4-6T Agustus untuk 20 juta penerima. APBN 2025 naik dari Rp71T ke Rp171T."" (180 chars)
https://t.co/quBJHtSufG","1912809306698993974","","","in","","0","0","0","https://x.com/beritainvestor/status/1912809306698993974","1899013801976217600","beritainvestor"
"1912931898097119255","2025-04-17T18:11:19.000Z","0","Dukung Program Makan Bergizi Gratis untuk anak-anak agar mereka bisa tumbuh sehat dan kuat. Setiap anak berhak mendapatkan gizi yang seimbang demi masa depan yang lebih baik #MBG https://t.co/KC4jWrnzpP","1912931898097119255","https://pbs.twimg.com/media/GowZbEsWoAAXLRt.jpg","","in","","0","0","0","https://x.com/ravidnath/status/1912931898097119255","1366085646","ravidnath"
"1912931724863873126","2025-04-17T18:10:38.000Z","0","Program makan bergizi gratis membantu para pelajar mendapatkan asupan yang mendukung kesehatan dan pembelajaran mereka. Dukung program ini untuk masa depan yang cerah #MBG https://t.co/mEuSh0t3sj","1912931724863873126","https://pbs.twimg.com/media/GowZQ_xXIAA8MO6.jpg","","in","","0","0","0","https://x.com/ravidnath/status/1912931724863873126","1366085646","ravidnath"
"1912826328807882845","2025-04-17T11:11:50.000Z","0","Kepala Badan Gizi Nasional (BGN) Dadan Hindayana menolak dirinya dan lembaganya dikaitkan dengan konflik mitra makan bergizi gratis (MBG) dengan Yayasan MBG berinisial MBN, buntut tak dibayarkannya tagihan hampir Rp1 miliar.

Dadan mengatakan BGN juga baru mengetahui yayasan dan https://t.co/s2zr6DYCW6","1912826328807882845","https://pbs.twimg.com/media/Gou5aAhaAAExNc8.jpg","","in","","1","1","0","https://x.com/inilahdotcom/status/1912826328807882845","46693036","inilahdotcom"
"1912878301296701886","2025-04-17T14:38:21.000Z","0","Anak sehat dimulai dari gizi cukup setiap hari. #MBG #MakanBergiziGratis #AnakSehatBangsaKuat #GiziUntukSemua https://t.co/YhzOc4Pipq","1912878301296701886","","","in","","0","1","0","https://x.com/wajah_baruitu/status/1912878301296701886","1562846317419737090","wajah_baruitu"
"1912826328807882845","2025-04-17T11:11:52.000Z","0","Dadan menuturkan hasil mediasi antara mitra dan yayasan yang dilakukan hari ini karena adanya kesalahpahaman. Dia meminta mitra tersebut tidak membawa-bawa BGN dalam permasalahan ini.

Sebelumnya, mitra dapur di Kalibata, Jakarta Selatan, melaporkan Yayasan MBG berinisial MBN ke https://t.co/1g2PAI8Uw8","1912826339503268004","https://pbs.twimg.com/media/Gou5amKawAAFm-W.jpg","inilahdotcom","in","","0","0","0","https://x.com/inilahdotcom/status/1912826339503268004","46693036","inilahdotcom"
"1912871637445448084","2025-04-17T14:11:52.000Z","0","Program MBG untuk para pelajar demi menunjang kesehatan &amp; pembelajaran #MBG #MakanBergiziGratis #AnakSehatBangsaKuat #GiziUntukSemua https://t.co/ZAwJiLLq8n","1912871637445448084","https://pbs.twimg.com/media/GovinFDaYAAmLnW.jpg","","in","","0","0","0","https://x.com/albanecress6/status/1912871637445448084","1879170175179927552","albanecress6"
"1912837263266074978","2025-04-17T11:55:17.000Z","3","Penyedia jasa katering program Makan Bergizi Gratis (MBG) untuk area Kalibata, Pancoran, Jakarta Selatan, mengaku merugi hampir Rp 1 miliar. Kerugian terjadi karena yayasan pengelola MBG belum membayar katering selama dua bulan.

#kanalsa #MBG #Makanbergizigratis https://t.co/93EcnHV9MV","1912837263266074978","https://pbs.twimg.com/media/GovDWA1asAALfB1.jpg","","in","","0","0","0","https://x.com/kanalsa_id/status/1912837263266074978","1767247974336454656","kanalsa_id"
"1912871476182524061","2025-04-17T14:11:14.000Z","0","Program MBG mendukung anak - anak dengan memberikan gizi yang cukup untuk tumbuh kembang yang optimal #MBG #MakanBergiziGratis #AnakSehatBangsaKuat #GiziUntukSemua https://t.co/pL1h0sZrzc","1912871476182524061","https://pbs.twimg.com/media/GovidpFboAAWMiu.jpg","","in","","0","0","0","https://x.com/albanecress6/status/1912871476182524061","1879170175179927552","albanecress6"
"1912841806993363365","2025-04-17T12:13:20.000Z","0","Program Makan Bergizi Gratis hadir untuk pastikan setiap anak Indonesia dapat asupan sehat dan seimbang tiap hari. Anak sehat hari ini, pemimpin hebat esok hari! #MBG #MakanBergiziGratis #AnakSehatBangsaKuat #GiziUntukSemua https://t.co/XvB3GUEu8g","1912841806993363365","https://pbs.twimg.com/media/GovHfHmbQAEa7IP.jpg","","in","","0","0","0","https://x.com/VitSentra/status/1912841806993363365","1669645311479025664","VitSentra"
"1912818725222228351","2025-04-17T10:41:37.000Z","1","Dibuang sayang
Old BTS Bra Set Mesh From Bra Shop Indonesia With Maharani. 

https://t.co/30y5dmRZyY via @YouTube 

#jualbra #juallingerie #mbg #brashopindonesia #btsphotoshoot #photoshootbts #ShopeeVIPGiveaway https://t.co/uJc42DARFB","1912818725222228351","https://pbs.twimg.com/media/GouxvzCa8AAfeCc.jpg","","in","","0","0","0","https://x.com/Bra_Shop/status/1912818725222228351","544834600","Bra_Shop"
"1912866283051524239","2025-04-17T13:50:35.000Z","1","Melalui Program Makan Bergizi Gratis, setiap anak Indonesia dijamin mendapatkan asupan yang sehat dan seimbang setiap harinya.  #MBG #MakanBergiziGratis #AnakSehatBangsaKuat #GiziUntukSemua https://t.co/qyAmYgQYYu","1912866283051524239","https://pbs.twimg.com/media/GovdvzGbUAA2OKb.jpg","","in","","0","1","0","https://x.com/nyai_bawi/status/1912866283051524239","1366903075890335744","nyai_bawi"
"1912749158739636280","2025-04-17T06:05:11.000Z","2","I'm convinced that MBG itu cuma asbunnya owo doang","1912749158739636280","","","in","","0","0","0","https://x.com/romansakimiaku/status/1912749158739636280","2958635211","romansakimiaku"
